{
  "schema_version": 1,
  "league_id": "1400628784381612032",
  "season": 2026,
  "scope": "1400628784381612032:2026:10",
  "as_of": "2026-09-11T05:06:17.248965+00:00",
  "horizon": {
    "start": "2026-09-11T05:06:17.248965+00:00",
    "end": "2026-09-13T05:06:17.248965+00:00"
  },
  "next_daily_at": "2026-09-11T13:00:00+00:00",
  "policy_hash": "5331bb768643d84a16c6987a8edd49a5d568aaf92378bd42368aff43e9b24931",
  "input_hash": "304bbee6a69b1351d37496a2c4b251adcd8ed59e1b557ac9478bfedbdd73e59d",
  "source_references": [
    {
      "path": "config/automation_plan_policy.example.json",
      "sha256": "d06a12a50ce83d08c6f2945cc10b966bf20242844d9817e0d9c8ea5115ed6ee6"
    },
    {
      "path": "data/automation/observations/304bbee6a69b1351d37496a2c4b251adcd8ed59e1b557ac9478bfedbdd73e59d/observations.json",
      "sha256": "69edadf52abf26ef55e2d0038c3b61fe94f5ecf17ad032efb24ba1210df21ce4"
    },
    {
      "path": "data/automation/observations/52c1c62c44c74202a049c499d57d1087/final_league.json",
      "sha256": "e86b6dbd5cc33803513cd8857e9e1272ec037eb503890509247ee9cc531583ea"
    },
    {
      "path": "data/automation/observations/52c1c62c44c74202a049c499d57d1087/final_rosters.json",
      "sha256": "dcf514b3cf8b6a91f6fe37316f89a66348931f3b149bee6fbcb7cfd544650955"
    },
    {
      "path": "data/automation/observations/52c1c62c44c74202a049c499d57d1087/league.json",
      "sha256": "4e1911c04dfd2b21231cd76f0bbbd06822e6174a4f712840755194563b3ea57e"
    },
    {
      "path": "data/automation/observations/52c1c62c44c74202a049c499d57d1087/observations.json",
      "sha256": "c2900cf93ec9df282b5e21075667412f2797379c0b2fdb658e5f32ee51ee5322"
    },
    {
      "path": "data/automation/observations/52c1c62c44c74202a049c499d57d1087/players.json",
      "sha256": "e01e384036fe5546783dd41279cc426f8453e6663eb818db2ece0430e9a15b33"
    },
    {
      "path": "data/automation/observations/52c1c62c44c74202a049c499d57d1087/rosters.json",
      "sha256": "67b344283462dba3acfaa2616c01601abba2ec970c73916b4fb73d632e3350f8"
    },
    {
      "path": "data/automation/observations/52c1c62c44c74202a049c499d57d1087/schedule.json",
      "sha256": "7933d8e2deaa33c2a100c6e809986d749c97233be04ee29bf9677b2b740ae2f2"
    },
    {
      "path": "data/automation/observations/52c1c62c44c74202a049c499d57d1087/state.json",
      "sha256": "492428f40239368fb9b779896bcd02e36ae60ef6065b35b4dab7f8f3134c3b91"
    },
    {
      "path": "data/automation/observations/52c1c62c44c74202a049c499d57d1087/user.json",
      "sha256": "e42cd3d3d1fb5b4668c5e165460690d60eaf97d87a387a275d9754e557ccf0bd"
    },
    {
      "path": "data/automation/rules/1400628784381612032.json",
      "sha256": "9367c73f1e2221f612dd19a4edefb16dc6e264c067bad994787d31820479727f"
    },
    {
      "path": "docs/LEAGUE_RULES_VERIFICATION.md",
      "sha256": "20b7375f30d302d22b7e11647ddbb3fdad665e7aaf106952bbade3c82b23a471"
    }
  ],
  "source_timestamps": {
    "league": {
      "fetched_at": "2026-09-11T05:06:12.838695+00:00",
      "cache_hit": false,
      "cache_age_seconds": 0.00012636184692382812,
      "network_attempts": 1,
      "source_updated_at": null
    },
    "state": {
      "fetched_at": "2026-09-11T05:06:12.940429+00:00",
      "cache_hit": false,
      "cache_age_seconds": 0.00015807151794433594,
      "network_attempts": 1,
      "source_updated_at": null
    },
    "user": {
      "fetched_at": "2026-09-11T05:06:13.164698+00:00",
      "cache_hit": false,
      "cache_age_seconds": 0.0009908676147460938,
      "network_attempts": 1,
      "source_updated_at": null
    },
    "rosters": {
      "fetched_at": "2026-09-11T05:06:13.390898+00:00",
      "cache_hit": false,
      "cache_age_seconds": 0.00015997886657714844,
      "network_attempts": 1,
      "source_updated_at": null
    },
    "players": {
      "fetched_at": "2026-09-11T05:06:14.604933+00:00",
      "cache_hit": false,
      "cache_age_seconds": 0.00015282630920410156,
      "network_attempts": 1,
      "source_updated_at": null
    },
    "schedule": {
      "dataset": "schedules",
      "season": 2026,
      "url": "https://raw.githubusercontent.com/nflverse/nfldata/master/data/games.csv",
      "git_blob_sha": "7a02a84177bd38e2cda9d5ad8517f1e8a41ddc3d",
      "sha256": "b2efaff208ab2262a37da827345abfb4c7e623590fa6c9b54d14e4cc75569651",
      "columns": [
        "game_id",
        "season",
        "game_type",
        "week",
        "gameday",
        "weekday",
        "gametime",
        "away_team",
        "away_score",
        "home_team",
        "home_score",
        "location",
        "result",
        "total",
        "overtime",
        "old_game_id",
        "gsis",
        "nfl_detail_id",
        "pfr",
        "pff",
        "espn",
        "ftn",
        "away_rest",
        "home_rest",
        "away_moneyline",
        "home_moneyline",
        "spread_line",
        "away_spread_odds",
        "home_spread_odds",
        "total_line",
        "under_odds",
        "over_odds",
        "div_game",
        "roof",
        "surface",
        "temp",
        "wind",
        "away_qb_id",
        "home_qb_id",
        "away_qb_name",
        "home_qb_name",
        "away_coach",
        "home_coach",
        "referee",
        "stadium_id",
        "stadium"
      ],
      "asset_updated_at": null,
      "fetched_at": "2026-09-11T05:06:16.947570+00:00",
      "metadata_checked_at": "2026-09-11T05:06:17.024227+00:00",
      "cache_hit": false,
      "network_attempts": 2
    },
    "final_league": {
      "fetched_at": "2026-09-11T05:06:17.177356+00:00",
      "cache_hit": false,
      "cache_age_seconds": 0.000102996826171875,
      "network_attempts": 1,
      "source_updated_at": null
    },
    "final_rosters": {
      "fetched_at": "2026-09-11T05:06:17.247090+00:00",
      "cache_hit": false,
      "cache_age_seconds": 0.0001480579376220703,
      "network_attempts": 1,
      "source_updated_at": null
    }
  },
  "issues": [
    "incomplete_observation",
    "waiver_exceptions_and_review_coverage_missing",
    "waiver_exceptions_and_review_coverage_unverified"
  ],
  "known_waiver_rules": {
    "schema_version": 1,
    "league_id": "1400628784381612032",
    "season": 2026,
    "confirmed_on": "2026-09-09",
    "confirmation_source": "user_supplied_league_settings_screenshot",
    "evidence_refs": [
      "docs/LEAGUE_RULES_VERIFICATION.md"
    ],
    "matched_settings": {
      "waiver_type": 0,
      "waiver_day_of_week": 2,
      "waiver_clear_days": 2
    },
    "confirmed_labels": {
      "waiver_type": "Rolling Waivers",
      "clear_waivers": "Wednesday (3 AM EDT)",
      "waiver_time": "2 Days"
    },
    "weekly_processing": {
      "weekday": "Wednesday",
      "local_time": "03:00",
      "displayed_timezone": "EDT",
      "timezone": "America/New_York",
      "dst_transition_verified": false,
      "exact_completion_time_guaranteed": false
    },
    "dropped_player_wait_days": 2,
    "remaining_checks": [
      "candidate_specific_claim_deadline",
      "custom_daily_waiver_ui_confirmation",
      "acquisition_and_drop_restrictions",
      "agent_review_deadlines"
    ]
  },
  "rule_settings_checked_at": "2026-09-11T05:06:12.838695+00:00",
  "obligations": [
    {
      "check_id": "m2-69b449b7f667a54f0c284d5f8061153bac37ac3a7e3ac3135cb25e6431fc4b82",
      "event_id": "2026_01_NE_SEA",
      "event_key": "6025e180c7b53d3167472d50d5514c168555ff839972f04e4a54654da11e0b41",
      "kind": "game",
      "offset_minutes": 90,
      "deadline_at": "2026-09-10T00:20:00+00:00",
      "player_ids": [
        "8676"
      ],
      "nominal_run_at": "2026-09-09T22:50:00+00:00",
      "disposition": "locked",
      "spec": {
        "check_id": "m2-69b449b7f667a54f0c284d5f8061153bac37ac3a7e3ac3135cb25e6431fc4b82",
        "expires_at": "2026-09-10T00:05:00+00:00",
        "latest_start_at": "2026-09-09T23:00:00+00:00",
        "operation": "validate_lineup",
        "run_at": "2026-09-09T22:50:00+00:00",
        "schema_version": 1,
        "scope": "1400628784381612032:2026:10",
        "season": 2026,
        "source_refs": [
          "config/automation_plan_policy.example.json",
          "data/automation/observations/304bbee6a69b1351d37496a2c4b251adcd8ed59e1b557ac9478bfedbdd73e59d/observations.json",
          "data/automation/observations/52c1c62c44c74202a049c499d57d1087/final_league.json",
          "data/automation/observations/52c1c62c44c74202a049c499d57d1087/final_rosters.json",
          "data/automation/observations/52c1c62c44c74202a049c499d57d1087/league.json",
          "data/automation/observations/52c1c62c44c74202a049c499d57d1087/observations.json",
          "data/automation/observations/52c1c62c44c74202a049c499d57d1087/players.json",
          "data/automation/observations/52c1c62c44c74202a049c499d57d1087/rosters.json",
          "data/automation/observations/52c1c62c44c74202a049c499d57d1087/schedule.json",
          "data/automation/observations/52c1c62c44c74202a049c499d57d1087/state.json",
          "data/automation/observations/52c1c62c44c74202a049c499d57d1087/user.json",
          "data/automation/rules/1400628784381612032.json",
          "docs/LEAGUE_RULES_VERIFICATION.md"
        ],
        "week": 1
      },
      "revision": "3afd1359954795e9150a0ec7b500d94de1aedef480553959f134110874adf3d7",
      "policy_hash": "5331bb768643d84a16c6987a8edd49a5d568aaf92378bd42368aff43e9b24931",
      "input_hash": "304bbee6a69b1351d37496a2c4b251adcd8ed59e1b557ac9478bfedbdd73e59d"
    },
    {
      "check_id": "m2-e620a0804c938409ca27c2e3139abfa796754184963274b2304bf37ef427abf1",
      "event_id": "2026_01_NE_SEA",
      "event_key": "6025e180c7b53d3167472d50d5514c168555ff839972f04e4a54654da11e0b41",
      "kind": "game",
      "offset_minutes": 30,
      "deadline_at": "2026-09-10T00:20:00+00:00",
      "player_ids": [
        "8676"
      ],
      "nominal_run_at": "2026-09-09T23:50:00+00:00",
      "disposition": "locked",
      "spec": {